{
  "version": "astra.scene_snapshot.v0",
  "scene_id": "fixture_thin_obstacle",
  "provenance": "SYNTHETIC_ANALYTICAL_TEST_NOT_SIMULATION",
  "coordinate_system": {
    "id": "robot_base",
    "units": "m",
    "axes": "+x forward, +y left, +z up; right-handed",
    "pose": "object center xyz in meters; unit quaternion wxyz, object local axes in robot_base"
  },
  "observations": {
    "rgb": [
      {
        "camera_id": "view-0",
        "path": "view-0.png",
        "sha256": "42bc91e0520ac91def4a41859374681631e0911f0abf8a9df742f29bcb2f71d6"
      },
      {
        "camera_id": "view-1",
        "path": "view-1.png",
        "sha256": "ab31719e5c764e1f5807d7e70596438b9a7f1483054b7fe23dcb89f65cb4ae6e"
      }
    ],
    "depth": [],
    "calibration": {
      "view-0": {
        "intrinsic": null,
        "resolution": [
          96,
          72
        ],
        "pose_base_xyz_wxyz": null,
        "axes": "SCHEMATIC_NO_PHYSICAL_CALIBRATION"
      },
      "view-1": {
        "intrinsic": null,
        "resolution": [
          96,
          72
        ],
        "pose_base_xyz_wxyz": null,
        "axes": "SCHEMATIC_NO_PHYSICAL_CALIBRATION"
      }
    },
    "robot_state": {
      "joint_names": [],
      "qpos_rad": [],
      "flange_pose_base_xyz_wxyz": null
    },
    "synchronization": {
      "simulation_step": null,
      "capture_span_s": 0.0,
      "timestamp_semantics": "synthetic immutable fixture",
      "same_step": true
    }
  },
  "geometry": {
    "reconstruction": null,
    "oracle": {
      "source": "SYNTHETIC_FIXTURE_TRUTH",
      "frame": "robot_base",
      "units": "m",
      "objects": [
        {
          "id": "target_cube",
          "center_m": [
            0.26,
            -0.1,
            0.1
          ],
          "size_m": [
            0.05,
            0.04,
            0.06
          ],
          "quaternion_wxyz": [
            1,
            0,
            0,
            0
          ]
        },
        {
          "id": "other",
          "center_m": [
            0.45,
            0.0,
            0.12
          ],
          "size_m": [
            0.06,
            0.06,
            0.06
          ],
          "quaternion_wxyz": [
            1,
            0,
            0,
            0
          ]
        }
      ],
      "regions": [
        {
          "id": "task_volume",
          "center_m": [
            0.6,
            0.2,
            0.12
          ],
          "size_m": [
            0.16,
            0.14,
            0.2
          ],
          "quaternion_wxyz": [
            1,
            0,
            0,
            0
          ]
        },
        {
          "id": "fit_volume",
          "center_m": [
            0.1,
            0.2,
            0.1
          ],
          "size_m": [
            0.1,
            0.09,
            0.08
          ],
          "quaternion_wxyz": [
            1,
            0,
            0,
            0
          ]
        },
        {
          "id": "workspace",
          "center_m": [
            0.4,
            0,
            0.25
          ],
          "size_m": [
            1.0,
            1.0,
            0.6
          ],
          "quaternion_wxyz": [
            1,
            0,
            0,
            0
          ]
        }
      ],
      "obstacles": [
        {
          "id": "obstacle",
          "center_m": [
            0.35,
            0.05,
            0.12
          ],
          "size_m": [
            0.001,
            0.13,
            0.19
          ],
          "quaternion_wxyz": [
            1,
            0,
            0,
            0
          ]
        }
      ],
      "renderings": []
    }
  },
  "ground_truth": {
    "source": "SYNTHETIC_FIXTURE_TRUTH",
    "frame": "robot_base",
    "units": "m",
    "objects": [
      {
        "id": "target_cube",
        "center_m": [
          0.26,
          -0.1,
          0.1
        ],
        "size_m": [
          0.05,
          0.04,
          0.06
        ],
        "quaternion_wxyz": [
          1,
          0,
          0,
          0
        ]
      },
      {
        "id": "other",
        "center_m": [
          0.45,
          0.0,
          0.12
        ],
        "size_m": [
          0.06,
          0.06,
          0.06
        ],
        "quaternion_wxyz": [
          1,
          0,
          0,
          0
        ]
      }
    ],
    "regions": [
      {
        "id": "task_volume",
        "center_m": [
          0.6,
          0.2,
          0.12
        ],
        "size_m": [
          0.16,
          0.14,
          0.2
        ],
        "quaternion_wxyz": [
          1,
          0,
          0,
          0
        ]
      },
      {
        "id": "fit_volume",
        "center_m": [
          0.1,
          0.2,
          0.1
        ],
        "size_m": [
          0.1,
          0.09,
          0.08
        ],
        "quaternion_wxyz": [
          1,
          0,
          0,
          0
        ]
      },
      {
        "id": "workspace",
        "center_m": [
          0.4,
          0,
          0.25
        ],
        "size_m": [
          1.0,
          1.0,
          0.6
        ],
        "quaternion_wxyz": [
          1,
          0,
          0,
          0
        ]
      }
    ],
    "obstacles": [
      {
        "id": "obstacle",
        "center_m": [
          0.35,
          0.05,
          0.12
        ],
        "size_m": [
          0.001,
          0.13,
          0.19
        ],
        "quaternion_wxyz": [
          1,
          0,
          0,
          0
        ]
      }
    ],
    "renderings": []
  },
  "task": [
    {
      "task_id": "understand",
      "kind": "understanding",
      "frame": "robot_base",
      "tolerance_m": 0.005,
      "instruction": "Answer the specified geometric questions in robot_base, meters.",
      "questions": [
        {
          "question_id": "relative_x",
          "type": "relation",
          "object_id": "target_cube",
          "other_id": "other",
          "axis": "x"
        },
        {
          "question_id": "position",
          "type": "position",
          "object_id": "target_cube"
        },
        {
          "question_id": "top_height",
          "type": "height",
          "object_id": "target_cube",
          "reference": "top"
        },
        {
          "question_id": "size",
          "type": "size",
          "object_id": "target_cube"
        },
        {
          "question_id": "gap_x",
          "type": "gap",
          "object_id": "target_cube",
          "other_id": "other",
          "axis": "x"
        },
        {
          "question_id": "fits",
          "type": "fit",
          "object_id": "target_cube",
          "region_id": "fit_volume",
          "quaternion_wxyz": [
            1,
            0,
            0,
            0
          ]
        }
      ],
      "constraints": {}
    },
    {
      "task_id": "plan",
      "kind": "placement",
      "frame": "robot_base",
      "tolerance_m": 0.005,
      "instruction": "Answer the specified geometric questions in robot_base, meters.",
      "questions": [],
      "constraints": {
        "object_id": "target_cube",
        "allowed_region_id": "task_volume",
        "clearance_m": 0.002,
        "required_quaternion_wxyz": [
          1,
          0,
          0,
          0
        ],
        "orientation_tolerance_rad": 0.05
      }
    }
  ]
}
